{
  "schema_version": "0.1",
  "site_id": "notre-dame-crc",
  "site_name": "Notre Dame CRC",
  "scheduler": "htcondor",
  "aliases": [
    "ND CRC",
    "Notre Dame CRC"
  ],
  "hostname_patterns": [
    "condorfe.crc.nd.edu"
  ],
  "documentation": {
    "allowed_domains": [
      "nd.edu"
    ],
    "preferred_path_tokens": [
      "crc",
      "condor"
    ]
  }
}
